{
  "$schema": "https://json-schema.org/draft/2020-12/schema",
  "$id": "https://ask-dyla.local/schemas/estimate.schema.json",
  "title": "Estimate",
  "description": "Effort estimate for a project, with the hierarchy epics -> tasks -> dev_tasks. Everything is measured in working days. This is the single source of truth: the xlsx exports (estimate.xlsx, dev_tasks.xlsx) are generated by the backend from this JSON, there are no separate files for the dev tasks. Totals are NOT stored here — consumers (backend/frontend) compute them by summing epics[].tasks[] + epics[].e2e + contingency_pct. Summing rule: if task.dev_tasks is non-empty, task.days MUST equal the sum of dev_tasks[].days (checked semantically in server/documents.py::save_doc, beyond the schema); if dev_tasks is empty, task.days is the directly estimated value. It also carries assumptions, general considerations and open questions for the users (sheets 'Assumptions and Considerations' and 'Questions for the Users' in the Excel export) — not really optional: any serious estimate has at least one of each.",
  "type": "object",
  "additionalProperties": false,
  "required": ["meta", "epics"],
  "properties": {
    "meta": {
      "type": "object",
      "description": "Metadata of the estimated project.",
      "additionalProperties": false,
      "required": ["project", "title", "date", "contingency_pct"],
      "properties": {
        "project": {
          "type": "string",
          "description": "Project folder slug (projects/{project})."
        },
        "title": {
          "type": "string",
          "description": "Readable title of the project/brief."
        },
        "client": {
          "type": ["string", "null"],
          "description": "Client name. Null if not specified."
        },
        "date": {
          "type": "string",
          "description": "Date of the estimate, YYYY-MM-DD format.",
          "pattern": "^\\d{4}-\\d{2}-\\d{2}$"
        },
        "contingency_pct": {
          "type": "number",
          "description": "Contingency percentage to apply to the total days (e.g. 15 for 15%).",
          "minimum": 0
        },
        "notes": {
          "type": ["string", "null"],
          "description": "Free-form notes on the estimate (general assumptions, confidence level, and so on)."
        },
        "status": {
          "type": "string",
          "description": "Editorial state of the document, for the 'chat stays conversational' UX: 'draft' while it is still being refined with the user in chat (citing elements by id), 'confirmed' once the user has validated the content. Optional field, for compatibility with pre-existing documents that do not carry it yet — a document without 'status' is treated as a draft.",
          "enum": ["draft", "confirmed"]
        },
        "dev_tasks_status": {
          "type": "string",
          "description": "Editorial state of the dev_tasks breakdown (separate from 'status', which only covers the estimate itself): 'draft' while the breakdown is being refined in chat, 'confirmed' once the user has validated it. Absent = the breakdown has not been generated for any task yet.",
          "enum": ["draft", "confirmed"]
        }
      }
    },
    "epics": {
      "type": "array",
      "description": "The epics of the estimate, in presentation order.",
      "items": {
        "type": "object",
        "additionalProperties": false,
        "required": ["id", "name", "tasks"],
        "properties": {
          "id": {
            "type": "string",
            "description": "Epic identifier, e.g. 'E1'.",
            "pattern": "^E\\d+$"
          },
          "name": {
            "type": "string",
            "description": "Epic name, e.g. '1. Epic Name'. It must be identical across every reference (dev_tasks) so that consumers can group rows consistently."
          },
          "tasks": {
            "type": "array",
            "description": "Development tasks of the epic (excluding the E2E row, handled separately in 'e2e').",
            "items": {
              "type": "object",
              "additionalProperties": false,
              "required": ["id", "task", "days", "description", "dev_tasks"],
              "properties": {
                "id": {
                  "type": "string",
                  "description": "Task identifier, e.g. 'E1.T1'.",
                  "pattern": "^E\\d+\\.T\\d+$"
                },
                "task": {
                  "type": "string",
                  "description": "Task name, written in the language a project manager would use, not in platform jargon."
                },
                "days": {
                  "type": "number",
                  "description": "Working days (development + unit test). Minimum 0.25, rounded to the nearest 0.5 above 1 day. If 'dev_tasks' is non-empty this value MUST equal the sum of dev_tasks[].days (checked semantically in server/documents.py::save_doc, beyond the schema) — otherwise it is the directly estimated value.",
                  "minimum": 0
                },
                "description": {
                  "type": "string",
                  "description": "Functional description of the task (1-2 sentences, in plain terms: what it does, not how it is built). An empty string is allowed but discouraged — any serious task has a description."
                },
                "dev_tasks": {
                  "type": "array",
                  "description": "Granular breakdown of the task into sub-tasks that can be assigned to developers (generated by /dev-tasks once the estimate is confirmed). Empty array if the breakdown has not been done for this task yet — in that case 'days' is the directly estimated value.",
                  "items": {
                    "type": "object",
                    "additionalProperties": false,
                    "required": ["id", "dev_task", "description", "days"],
                    "properties": {
                      "id": {
                        "type": "string",
                        "description": "Dev task identifier, scoped to the parent task, e.g. 'E2.T3.D1'.",
                        "pattern": "^E\\d+\\.T\\d+\\.D\\d+$"
                      },
                      "dev_task": {
                        "type": "string",
                        "description": "Name of the granular sub-task: what the developer concretely builds."
                      },
                      "description": {
                        "type": "string",
                        "description": "Technical description for the developer (3-10 lines): tables and columns, objects to create, references to the brief, sub-flows, connections, and so on."
                      },
                      "days": {
                        "type": "number",
                        "description": "Working days for this dev task.",
                        "minimum": 0
                      },
                      "owner": {
                        "type": "string",
                        "description": "Assigned developer. Empty string if not assigned yet (filled in during planning)."
                      },
                      "layer": {
                        "type": "integer",
                        "description": "Technical layer: it determines the execution order inside the epic on the project timeline. 1 = data model and data structures; 2 = forms and screens; 3 = business rules, processes, integrations, notifications (parallelizable among themselves); 4 = E2E tests. Layers 1-2-3-4 are sequential within the same epic; different epics proceed in parallel.",
                        "minimum": 1,
                        "maximum": 4
                      },
                      "depends_on": {
                        "type": "array",
                        "description": "Explicit dependency override, for the cases the layer does not capture. Ids of dev tasks that must be completed before this one.",
                        "items": {
                          "type": "string",
                          "pattern": "^E\\d+\\.T\\d+\\.D\\d+$"
                        }
                      }
                    }
                  }
                }
              }
            }
          },
          "e2e": {
            "description": "The E2E test row of the epic. Every epic MUST have one; null only in exceptional cases, during intermediate drafts.",
            "oneOf": [
              {
                "type": "object",
                "additionalProperties": false,
                "required": ["label", "days"],
                "properties": {
                  "label": {
                    "type": "string",
                    "description": "Label of the E2E row, e.g. 'E2E test of the Epic Name flow'."
                  },
                  "days": {
                    "type": "number",
                    "description": "Working days for the E2E test.",
                    "minimum": 0
                  }
                }
              },
              { "type": "null" }
            ]
          }
        }
      }
    },
    "assumptions": {
      "type": "array",
      "description": "Assumptions the estimator made to produce the estimate (e.g. 'Basic validation = required fields plus a maximum amount check, no cross-field logic'). They must be made explicit: they are the first thing to revisit if the estimate turns out to be wrong. Sheet 'Assumptions and Considerations' in the Excel export.",
      "items": { "type": "string" }
    },
    "considerations": {
      "type": "array",
      "description": "General considerations about the project or the estimate (risk, dependencies, notes on the team, patterns applied). Sheet 'Assumptions and Considerations' in the Excel export, below the assumptions.",
      "items": { "type": "string" }
    },
    "open_questions": {
      "type": "array",
      "description": "Open questions for the client or user that, once answered, could change the estimate (e.g. 'Can an attachment have attachments of its own?'). Sheet 'Questions for the Users' in the Excel export.",
      "items": {
        "type": "object",
        "additionalProperties": false,
        "required": ["area", "question"],
        "properties": {
          "area": {
            "type": "string",
            "description": "Area or epic the question refers to (e.g. 'Data model', 'Notifications')."
          },
          "question": {
            "type": "string",
            "description": "Text of the question."
          },
          "estimated_impact": {
            "type": "string",
            "description": "Estimated impact on the estimate if the answer changes the current assumptions (e.g. '+1 day if yes'). Free-form string, qualitative or quantitative."
          },
          "priority": {
            "type": "string",
            "description": "Priority of the question.",
            "enum": ["high", "medium", "low"]
          }
        }
      }
    }
  }
}
